source,published_date,month,title,url,text_len,econ_hit,uncertainty_hit,policy_hit
IrishTimes,2025-12-17,2025-12-01,‘Gold cards’ and a gilded toilet: Donald Trump’s affordability message problem,https://www.irishtimes.com/world/us/2025/12/17/gold-cards-and-a-gilded-toilet-donald-trumps-affordability-message-problem/,5856,1,1,1
IrishTimes,2025-12-17,2025-12-01,Irish mortgage arrears fall again to lowest level since 2009,https://www.irishtimes.com/business/2025/12/17/irish-mortgage-arrears-fall-again-to-lowest-level-since-2009/,3184,1,1,1
IrishTimes,2025-12-18,2025-12-01,The Irish Times view on foreign direct investment: encouragement amid uncertainty,https://www.irishtimes.com/opinion/editorials/2025/12/18/the-irish-times-view-on-foreign-direct-investment-encouragement-amid-uncertainty/,2824,1,1,1
IrishTimes,2025-12-18,2025-12-01,"Foreign direct investment into Ireland hits record level despite US tariffs, says IDA",https://www.irishtimes.com/business/2025/12/18/ida-says-foreign-direct-investment-hit-record-level-this-year-despite-us-tariffs/,3592,1,1,1
IrishTimes,2025-12-18,2025-12-01,Global shares jump as markets cheer US inflation surprise,https://www.irishtimes.com/business/2025/12/18/global-shares-jump-as-markets-cheer-us-inflation-surprise/,3749,1,1,1
IrishTimes,2025-12-18,2025-12-01,ECB holds interest rates steady once again,https://www.irishtimes.com/business/2025/12/18/ecb-holds-interest-rates-steady-once-again/,3366,1,1,1
IrishTimes,2025-12-18,2025-12-01,"Data centre expansion must align with energy security and wider social needs, review finds",https://www.irishtimes.com/environment/2025/12/18/data-centre-expansion-must-align-with-energy-security-and-wider-social-needs-review-finds/,3810,1,1,1
IrishTimes,2025-12-18,2025-12-01,"Hybrid threats expected to increase during Ireland’s EU presidency, department warns",https://www.irishtimes.com/politics/2025/12/18/hybrid-threats-expected-to-increase-during-irelands-eu-presidency-department-warns/,3463,1,1,1
IrishTimes,2025-12-18,2025-12-01,Is now the time to buy a house in Ireland or should you wait?,https://www.irishtimes.com/property/residential/2025/12/18/fiona-reddan-is-now-the-time-to-buy-a-house-or-should-you-wait/,9848,1,1,1
IrishTimes,2025-12-18,2025-12-01,"Small company rescue applications down 23% in 2025, but ‘headwinds’ loom in 2026",https://www.irishtimes.com/business/2025/12/18/small-company-rescue-applications-down-23-in-2025-but-headwinds-loom-in-2026/,3088,1,1,1
IrishTimes,2025-12-18,2025-12-01,M&A market ‘robust’ in 2025 as Irish economy continues to tick a lot of boxes,https://www.irishtimes.com/special-reports/2025/12/18/ma-market-robust-in-2025-as-irish-economy-continues-to-tick-a-lot-of-boxes/,5482,1,1,1
IrishTimes,2025-12-18,2025-12-01,Accelerated emissions reductions required to meet climate targets,https://www.irishtimes.com/special-reports/2025/12/18/accelerated-emissions-reductions-required-to-meet-climate-targets/,8400,1,1,1
IrishTimes,2025-12-19,2025-12-01,European shares close at record high driven by defence stocks,https://www.irishtimes.com/business/2025/12/19/european-shares-close-at-record-high-driven-by-defence-stocks/,4043,1,1,1
IrishTimes,2025-12-19,2025-12-01,"Central Bank questions Government housing target of 300,000 new homes",https://www.irishtimes.com/business/2025/12/19/central-bank-raises-doubts-over-government-housing-targets/,3504,1,1,1
IrishTimes,2025-12-19,2025-12-01,Future of US in the Asia-Pacific is under close consideration,https://www.irishtimes.com/world/asia-pacific/2025/12/19/future-of-us-in-the-asia-pacific-is-under-close-consideration/,5326,1,1,1
IrishTimes,2025-12-19,2025-12-01,Strong demand across the board for the right skills,https://www.irishtimes.com/special-reports/2025/12/19/strong-demand-across-the-board-for-the-right-skills/,5283,1,1,1
IrishTimes,2025-12-20,2025-12-01,Cliff Taylor: A second class business degree won’t be much use in the world of AI,https://www.irishtimes.com/opinion/2025/12/20/in-the-world-of-ai-a-second-class-business-degree-wont-be-much-use/,6437,1,1,1
IrishTimes,2025-12-22,2025-12-01,Trump names special envoy for Greenland,https://www.irishtimes.com/world/us/2025/12/22/donald-trump-names-special-envoy-for-greenland/,4263,1,1,1
IrishTimes,2025-12-24,2025-12-01,The Irish Times view on Christmas 2025: a time to remain hopeful,https://www.irishtimes.com/opinion/editorials/2025/12/24/the-irish-times-view-on-christmas-2025-a-time-to-remain-hopeful/,4598,1,1,1
IrishTimes,2025-12-25,2025-12-01,Neglected emergencies: seven humanitarian crises you may have missed in 2025,https://www.irishtimes.com/world/2025/12/25/neglected-emergencies-seven-humanitarian-crises-you-may-have-missed-in-2025/,7112,1,1,1
IrishTimes,2025-12-25,2025-12-01,"AI, Liberation Day chaos, and Irish taxpayers exiting AIB: Your A-Z of markets in 2025",https://www.irishtimes.com/business/2025/12/25/ai-liberation-day-chaos-and-irish-taxpayers-exiting-aib-your-a-z-of-markets-in-2025/,12598,1,1,1
IrishTimes,2025-12-26,2025-12-01,The Irish Times view on the political year: lagging behind reality,https://www.irishtimes.com/opinion/editorials/2025/12/26/the-irish-times-view-on-the-political-year-lagging-behind-reality/,4971,1,1,1
IrishTimes,2025-12-26,2025-12-01,"The winners and losers of Irish business in 2025: Tariffs, turbulence and turmoil",https://www.irishtimes.com/business/2025/12/26/from-bust-distillers-to-the-barchester-billionaires-the-irish-business-winners-and-losers-this-year/,17633,1,1,1
IrishTimes,2025-12-26,2025-12-01,Cliff Taylor: Seven key things that could affect the Irish economy next year,https://www.irishtimes.com/business/2025/12/26/seven-key-things-that-could-impact-the-irish-economy-next-year/,9933,1,1,1
IrishTimes,2025-12-26,2025-12-01,Rift between DAA board and its CEO Kenny Jacobs a major headache for Darragh O’Brien,https://www.irishtimes.com/business/2025/12/26/rift-between-daa-board-and-its-ceo-kenny-jacobs-creates-major-headache-for-darragh-obrien/,10376,1,1,1
IrishTimes,2025-12-27,2025-12-01,Cliff Taylor: What does history teach us about the AI-driven boom on the stock market?,https://www.irishtimes.com/opinion/2025/12/27/cliff-taylor-ai-boom-has-worrying-echoes-of-past-crashes/,6346,1,1,1
IrishTimes,2025-12-27,2025-12-01,‘Made in Bangladesh’: the reality of a garment industry that fills Ireland’s shops,https://www.irishtimes.com/life-style/people/2025/12/27/made-in-bangladesh-the-reality-of-nations-garment-industry/,11702,1,1,1
IrishTimes,2025-12-29,2025-12-01,Forecasting the world in 2026: Will Trump win the Nobel peace prize? Will Starmer survive?,https://www.irishtimes.com/world/2025/12/29/forecasting-the-world-in-2026-will-trump-win-the-nobel-peace-prize-will-starmer-survive/,14003,1,1,1
IrishTimes,2025-12-29,2025-12-01,How 2025 became year of rising prices and cost of living,https://www.irishtimes.com/your-money/2025/12/29/how-2025-became-year-of-rising-prices-and-cost-of-living/,17232,1,1,1
IrishTimes,2025-12-30,2025-12-01,Media in 2025: the shadow of Trump hangs over everything,https://www.irishtimes.com/media/2025/12/30/media-in-2025-the-shadow-of-trump-hangs-over-everything/,6760,1,1,1
IrishTimes,2025-12-31,2025-12-01,Six economic flashpoints to watch out for in 2026,https://www.irishtimes.com/business/2025/12/31/six-economic-flashpoints-to-watch-out-for-in-2026/,11854,1,1,1
IrishTimes,2025-12-31,2025-12-01,"Irish economy set for robust growth, but risks remain",https://www.irishtimes.com/business/2025/12/31/irish-economy-set-for-robust-growth-but-risks-remain/,3568,1,1,1
