source,published_date,month,title,url,text_len,econ_hit,uncertainty_hit,policy_hit
IrishTimes,2025-10-14,2025-10-01,"ECB will not commit to a pre-determined path on rates, says Makhlouf",https://www.irishtimes.com/business/2025/10/14/ecb-will-not-commit-to-a-pre-determined-path-on-rates-says-makhlouf/,1993,1,1,1
IrishTimes,2025-10-14,2025-10-01,"Stock market ‘concentration risk’ now higher than dot-com bubble period, IMF warns",https://www.irishtimes.com/business/2025/10/14/stock-market-concentration-risk-now-higher-than-dot-com-bubble-period-imf-warns/,3165,1,1,1
IrishTimes,2025-10-14,2025-10-01,"Citigroup, JP Morgan and Goldman Sachs all report soaring revenue",https://www.irishtimes.com/business/financial-services/2025/10/14/citigroup-jp-morgan-and-goldman-sachs-all-report-soaring-revenue/,3632,1,1,1
IrishTimes,2025-10-14,2025-10-01,"Negative impact of tariffs starting to show, IMF warns",https://www.irishtimes.com/business/2025/10/14/negative-impact-of-tariffs-starting-to-show-imf-warns/,3817,1,1,1
IrishTimes,2025-10-15,2025-10-01,Smart approach required to deliver National Development Plan,https://www.irishtimes.com/special-reports/2025/10/15/smart-approach-required-to-deliver-national-development-plan/,8750,1,1,1
IrishTimes,2025-10-16,2025-10-01,European stocks and euro inch higher as France passes test,https://www.irishtimes.com/business/2025/10/16/european-stocks-and-euro-inch-higher-as-france-passes-test/,4281,1,1,1
IrishTimes,2025-10-16,2025-10-01,"‘We were raised up with the Irish since 1978, and suddenly they are pulling out’",https://www.irishtimes.com/politics/2025/10/16/we-were-raised-up-with-the-irish-since-1978-and-suddenly-they-are-pulling-out/,4341,1,1,1
IrishTimes,2025-10-16,2025-10-01,Ireland forecast to be fastest growing economy in 2025,https://www.irishtimes.com/business/2025/10/16/ireland-forecast-to-be-fastest-growing-economy-in-2025/,2261,1,1,1
IrishTimes,2025-10-17,2025-10-01,Business leaders believe complying with climate rules will ‘significantly’ increase costs,https://www.irishtimes.com/business/2025/10/17/business-leaders-believe-compliance-with-climate-regulations-will-significantly-increase-their-costs/,2050,1,1,1
IrishTimes,2025-10-17,2025-10-01,"Debt in several EU countries is on potentially explosive path, IMF warns",https://www.irishtimes.com/business/2025/10/17/debt-in-several-eu-countries-on-potentially-explosive-path-imf-warns/,3381,1,1,1
IrishTimes,2025-10-17,2025-10-01,Are we overegging the threat from US tariffs?,https://www.irishtimes.com/business/economy/2025/10/17/are-we-overegging-the-threat-from-us-tariffs/,5270,1,1,1
IrishTimes,2025-10-18,2025-10-01,Kevin Rafter: The four most important issues in the new president’s in-tray,https://www.irishtimes.com/opinion/2025/10/18/kevin-rafter-the-four-most-important-issues-in-the-new-presidents-in-tray/,6852,1,1,1
IrishTimes,2025-10-20,2025-10-01,Grocery inflation at 6.5% as Irish households face rising pre-Christmas costs,https://www.irishtimes.com/business/2025/10/20/grocery-inflation-surges-to-highest-rate-since-2023/,4076,1,1,1
IrishExaminer,2025-10-21,2025-10-01,‘Fog lifting’ on economic risks as pharma sector weathers global policy uncertainty — report,https://www.irishexaminer.com/business/economy/arid-41728257.html,1154,1,1,1
IrishTimes,2025-10-21,2025-10-01,No honeymoon for Japan’s first female prime minister Sanae Takaichi,https://www.irishtimes.com/world/asia-pacific/2025/10/21/sanae-takaichi-becomes-japans-first-female-prime-minister/,3681,1,1,1
IrishTimes,2025-10-21,2025-10-01,Costly Christmas in store as grocery prices soar,https://www.irishtimes.com/ireland/2025/10/21/costly-christmas-in-store-as-grocery-prices-soar/,3092,1,1,1
IrishTimes,2025-10-22,2025-10-01,The Irish Times view on business and the economy: an uneasy calm prevails,https://www.irishtimes.com/opinion/editorials/2025/10/22/the-irish-times-view-on-business-and-the-economy-an-uneasy-calm-prevails/,2047,1,1,1
IrishTimes,2025-10-22,2025-10-01,Do we want to be the best small country in the world for class action law suits?,https://www.irishtimes.com/business/2025/10/22/do-we-want-to-be-the-best-small-country-in-the-world-for-class-action-law-suits/,5012,1,1,1
IrishTimes,2025-10-22,2025-10-01,Goodbody upgrades growth forecasts for Irish economy while warning of softer FDI trends,https://www.irishtimes.com/business/2025/10/22/goodbody-upgrades-growth-forecasts-for-irish-economy-while-warning-of-softer-fdi-trends/,3024,1,1,1
IrishTimes,2025-10-22,2025-10-01,High-end amenities in office buildings? These New York tenants say no thanks,https://www.irishtimes.com/property/commercial-property/2025/10/22/high-end-amenities-in-office-buildings-these-new-york-tenants-say-no-thanks/,7703,1,1,1
IrishTimes,2025-10-24,2025-10-01,‘Do you have any friends in the IRA?’: how Russia’s hybrid war is sowing chaos across Europe,https://www.irishtimes.com/world/europe/2025/10/24/from-pigs-heads-to-arson-plots-how-russias-hybrid-war-is-sowing-chaos-across-europe/,14511,1,1,1
IrishTimes,2025-10-24,2025-10-01,Irish consumer sentiment falls as rising living costs bite,https://www.irishtimes.com/business/2025/10/24/irish-consumer-sentiment-falls-as-rising-living-costs-bite/,2621,1,1,1
IrishTimes,2025-10-25,2025-10-01,This is a disastrous day for Fianna Fáil and Fine Gael,https://www.irishtimes.com/politics/2025/10/25/this-is-a-disastrous-day-for-fianna-fail-and-fine-gael/,4281,1,1,1
IrishTimes,2025-10-25,2025-10-01,"Worldview: If Nigel Farage wins the next UK election, the consequences for Ireland will be profound",https://www.irishtimes.com/opinion/2025/10/25/worldview-if-nigel-farage-wins-the-next-uk-election-the-consequences-for-ireland-will-be-profound/,5485,1,1,1
IrishTimes,2025-10-27,2025-10-01,"Letters to the Editor, October 26th: Scenes of violence and children, climate change and farming and marathon journeys",https://www.irishtimes.com/opinion/letters/2025/10/27/letters-to-the-editor-october-26th-scenes-of-violence-and-children-climate-change-and-farming-and-marathon-journeys/,12591,1,1,1
IrishTimes,2025-10-28,2025-10-01,Shannon-based diamond group Element Six pays out $10m dividend as profits fall by half,https://www.irishtimes.com/business/2025/10/28/shannon-based-diamond-group-element-six-pays-out-10m-dividend-as-profits-fall-by-half/,2365,1,1,1
IrishTimes,2025-10-28,2025-10-01,PwC abandons headcount target as revenue growth slows,https://www.irishtimes.com/business/2025/10/28/pwc-abandons-headcount-target-as-revenue-growth-slows/,4109,1,1,1
IrishTimes,2025-10-29,2025-10-01,Uisce Éireann defends projections for Shannon pipeline indicating  ‘potential to serve 50% of national needs’,https://www.irishtimes.com/environment/2025/10/29/uisce-eireann-shannon-pipeline-criticism/,4174,1,1,1
IrishTimes,2025-10-30,2025-10-01,Aviation sector faces turbulence on the path to net zero,https://www.irishtimes.com/special-reports/2025/10/30/aviation-sector-faces-turbulence-on-the-path-to-net-zero/,5285,1,1,1
IrishTimes,2025-10-30,2025-10-01,ECB keeps rates unchanged while warning of uncertain impact from tariffs,https://www.irishtimes.com/business/2025/10/30/ecb-keeps-rates-unchanged-while-warning-of-uncertain-impact-from-tariffs/,3337,1,1,1
IrishTimes,2025-10-30,2025-10-01,"Data protection rules ‘completely out of control’, Meta tells Government",https://www.irishtimes.com/technology/big-tech/2025/10/30/data-protection-rules-completely-out-of-control-meta-tells-government/,4331,1,1,1
IrishTimes,2025-10-30,2025-10-01,Rising energy and food prices keep Irish inflation rate elevated at 2.7%,https://www.irishtimes.com/business/2025/10/30/rising-energy-and-food-prices-keep-irish-inflation-rate-elevated-at-27/,2771,1,1,1
IrishTimes,2025-10-30,2025-10-01,ECB in a holding pattern on interest rates,https://www.irishtimes.com/business/2025/10/30/ecb-in-a-holding-pattern-on-interest-rates/,2055,1,1,1
IrishTimes,2025-10-30,2025-10-01,A quiet solar revolution: home rooftops and farms powering a renewable future,https://www.irishtimes.com/special-reports/2025/10/30/a-quiet-solar-revolution-home-rooftops-and-farms-powering-a-renewable-future/,5059,1,1,1
IrishTimes,2025-10-30,2025-10-01,Who will lead the world into a clean energy future?,https://www.irishtimes.com/special-reports/2025/10/30/who-will-lead-the-world-into-a-clean-energy-future/,5624,1,1,1
IrishTimes,2025-10-31,2025-10-01,Euro zone inflation dips closer to 2% as ECB holds rates,https://www.irishtimes.com/business/2025/10/31/eurozone-inflation-dips-closer-to-2-as-ecb-holds-rates/,2793,1,1,1
IrishTimes,2025-10-31,2025-10-01,‘I lived in bedsits and above Chinese restaurants’: Housing Agency chief on tackling accommodation crisis,https://www.irishtimes.com/business/2025/10/31/housing-is-the-single-biggest-shared-challenge-facing-ireland-right-now-and-the-chance-to-work-on-that-highly-motivated-me/,12387,1,1,1
IrishTimes,2025-11-01,2025-11-01,High stakes at Cop30: ‘Climate denialism is back at a point we thought we’d moved on from’,https://www.irishtimes.com/life-style/people/2025/11/01/high-stakes-at-cop30-climate-denialism-is-back-at-a-point-we-thought-wed-moved-on-from/,14352,1,1,1
IrishTimes,2025-11-03,2025-11-01,Opinion: The Fianna Fáil I joined was the party that got things done. What happened to us?,https://www.irishtimes.com/opinion/2025/11/03/opinion-the-fianna-fail-i-joined-was-the-party-that-got-things-done-what-happened-to-us/,6172,1,1,1
IrishExaminer,2025-11-05,2025-11-01,"Climate change putting Ireland's economic stability at risk, Central Bank warns",https://www.irishexaminer.com/news/arid-41736552.html,1024,1,1,1
IrishTimes,2025-11-05,2025-11-01,Global markets climb as tech stocks rebound,https://www.irishtimes.com/business/2025/11/05/global-markets-climb-as-tech-stocks-rebound/,3979,1,1,1
IrishTimes,2025-11-05,2025-11-01,Weak investment to mitigate extreme weather sharpens risk to ‘Ireland’s fiscal resilience’,https://www.irishtimes.com/business/economy/2025/11/05/stalled-investment-to-counter-extreme-weather-increases-risk-to-irelands-financial-resilience-report/,4203,1,1,1
IrishTimes,2025-11-06,2025-11-01,European shares fall as concerns over tech giants’ valuations continue,https://www.irishtimes.com/business/2025/11/06/european-shares-fall-as-concerns-over-tech-giants-valuations-continue/,3964,1,1,1
IrishTimes,2025-11-06,2025-11-01,How can Ireland help to sustainably feed 10bn people and slow global warming by 2050?,https://www.irishtimes.com/environment/climate-crisis/2025/11/06/how-can-ireland-help-to-sustainably-feed-10bn-people-and-slow-global-warming-by-2050/,8985,1,1,1
IrishTimes,2025-11-07,2025-11-01,Opinion: Why does Brigitte Macron inspire such vitriol in France?,https://www.irishtimes.com/opinion/2025/11/07/opinion-why-does-brigitte-macron-inspire-such-vitriol-in-france/,5485,1,1,1
IrishExaminer,2025-11-09,2025-11-01,US agency warns Ireland's multinational tax lifeline grows thinner,https://www.irishexaminer.com/business/economy/arid-41739381.html,865,1,1,1
IrishTimes,2025-11-10,2025-11-01,Claire Hanna: Presidential election made clear that we cannot just wish ourselves into a united Ireland,https://www.irishtimes.com/opinion/2025/11/10/claire-hanna-presidential-election-made-clear-that-we-cannot-just-wish-ourselves-into-a-united-ireland/,5882,1,1,1
IrishTimes,2025-11-11,2025-11-01,"Unions will fight for next round of public sector pay increases, new Siptu leader says",https://www.irishtimes.com/ireland/2025/11/11/unions-will-fight-for-next-round-of-public-sector-pay-increases-new-siptu-leader-says/,2755,1,1,1
IrishTimes,2025-11-11,2025-11-01,Why is Donald Trump reaching out to Syria’s new president Ahmed al-Sharaa?,https://www.irishtimes.com/world/2025/11/11/why-is-donald-trump-reaching-out-to-syrias-new-president-ahmed-al-sharaa/,3164,1,1,1
IrishTimes,2025-11-12,2025-11-01,Keir Starmer denies authorising ‘kneecap’ attack on health secretary amid leadership crisis,https://www.irishtimes.com/world/uk/2025/11/12/uk-minister-dismisses-claims-of-plot-to-oust-keir-starmer-theyve-been-watching-too-much-celebrity-traitors/,5534,1,1,1
IrishTimes,2025-11-12,2025-11-01,How truthful are Irish people when valuing their houses for LPT?,https://www.irishtimes.com/your-money/2025/11/12/how-truthful-are-we-when-it-comes-to-valuing-our-houses-for-the-tax-man/,5281,1,1,1
IrishTimes,2025-11-13,2025-11-01,"‘Too early’ to commit to December US interest rate cut, says Fed’s Daly",https://www.irishtimes.com/business/2025/11/13/too-early-to-commit-to-december-us-interest-rate-cut-says-feds-daly/,2580,1,1,1
IrishTimes,2025-11-13,2025-11-01,"A 10% slide in US visitor numbers would have ‘painful impact’ on Irish tourism sector, report warns",https://www.irishtimes.com/business/2025/11/13/a-10-slide-in-us-visitor-numbers-would-have-painful-impact-on-irish-tourism-sector-report-warns/,2323,1,1,1
IrishTimes,2025-11-14,2025-11-01,European shares fall as US rate cut hopes wane and UK fiscal worries rise,https://www.irishtimes.com/business/2025/11/14/european-shares-fall-as-us-rate-cut-hopes-wane-and-uk-fiscal-worries-rise/,3974,1,1,1
IrishTimes,2025-11-15,2025-11-01,Two Government departments clash over plan to pressure tech giants over social media scams,https://www.irishtimes.com/ireland/2025/11/15/i-have-serious-concerns-departments-clash-over-proposal-to-tackle-social-media-scams/,4266,1,1,1
IrishExaminer,2025-11-17,2025-11-01,"'Disorderly correction' to AI-fuelled surge in US stocks could 'spill over' to Irish economy, Central Bank warns",https://www.irishexaminer.com/business/economy/arid-41744178.html,1094,1,1,1
IrishExaminer,2025-11-17,2025-11-01,David McNamara: Irish economy shows strength in adversity,https://www.irishexaminer.com/business-columnists/arid-41744031.html,1315,1,1,1
IrishTimes,2025-11-17,2025-11-01,Central Bank warns of risks to Ireland amid ‘stretched’ US tech valuations,https://www.irishtimes.com/business/2025/11/17/central-bank-warns-of-risks-to-ireland-amid-stretched-us-tech-valuations/,4455,1,1,1
IrishTimes,2025-11-17,2025-11-01,Irish economy forecast to grow at eight times euro area average,https://www.irishtimes.com/business/2025/11/17/irish-economy-forecast-to-grow-at-eight-times-euro-area-average/,4188,1,1,1
IrishTimes,2025-11-17,2025-11-01,Garda probe on insider trading and Government response to AI,https://www.irishtimes.com/business/2025/11/17/garda-probe-on-insider-trading-and-government-response-to-ai/,2702,1,1,1
IrishTimes,2025-11-17,2025-11-01,"AIB raises Irish economic forecast, noting ‘robust’ performance amid global uncertainty",https://www.irishtimes.com/business/2025/11/17/aib-raises-irish-economic-forecasts-amid-resilience-to-tariffs-and-uncertainty/,3135,1,1,1
IrishTimes,2025-11-18,2025-11-01,TDs express shock at Paschal Donohoe’s departure; Simon Harris to become Minister for Finance as part of reshuffle,https://www.irishtimes.com/politics/2025/11/18/live-updates-paschal-donohoe-to-resign/,35164,1,1,1
IrishTimes,2025-11-18,2025-11-01,European shares sink to one-month low on US rates and tech valuations concerns,https://www.irishtimes.com/business/markets/2025/11/18/european-shares-sink-to-one-month-low-on-us-rates-and-tech-valuations-concerns/,4014,1,1,1
IrishTimes,2025-11-18,2025-11-01,Bitcoin loses all its 2025 gains as it sheds more than a quarter of its value in month-long slide,https://www.irishtimes.com/business/2025/11/18/bitcoin-loses-all-its-2025-gains-as-it-sheds-more-than-a-quarter-of-its-value-in-month-long-slide/,2830,1,1,1
IrishTimes,2025-11-18,2025-11-01,"Eamon Ryan: At Cop30 I ask myself, is this really working?",https://www.irishtimes.com/opinion/2025/11/18/eamon-ryan-at-cop30-i-ask-myself-is-this-really-working/,5246,1,1,1
IrishTimes,2025-11-18,2025-11-01,Is putting some of corporation tax windfall into long-term funds the right thing to do?,https://www.irishtimes.com/business/2025/11/18/is-putting-some-of-the-corporation-tax-windfall-into-long-term-funds-the-right-thing-to-do/,7353,1,1,1
IrishTimes,2025-11-20,2025-11-01,Scarifying risks and malign scenarios: Five crunch issues facing Simon Harris,https://www.irishtimes.com/your-money/2025/11/20/the-five-crunch-issues-facing-simon-harris-as-minister-for-finance/,8573,1,1,1
IrishTimes,2025-11-22,2025-11-01,"Simon Harris’s short time at Foreign Affairs: building bridges, less foreign travel - and a lot of press releases",https://www.irishtimes.com/politics/2025/11/22/how-did-simon-harris-perform-in-his-short-time-as-minister-for-foreign-affairs/,8003,1,1,1
IrishTimes,2025-11-22,2025-11-01,Harris yet to prove he’s serious about Finance role,https://www.irishtimes.com/business/2025/11/22/harris-yet-to-prove-hes-serious-about-finance-role/,2202,1,1,1
IrishExaminer,2025-11-24,2025-11-01,Hydrogen: Navigating a role in the Clean Energy Transition,https://www.irishexaminer.com/special-reports/arid-41742669.html,5163,1,1,1
IrishTimes,2025-11-24,2025-11-01,Lawrence Summers: an intellectual giant’s extraordinary fall from grace,https://www.irishtimes.com/business/2025/11/24/lawrence-summers-an-intellectual-giants-extraordinary-fall-from-grace/,9025,1,1,1
IrishTimes,2025-11-25,2025-11-01,"Palestinian economy suffers collapse after Israel-Hamas conflict, UN says",https://www.irishtimes.com/world/middle-east/2025/11/25/palestinian-economy-suffers-collapse-after-israel-hamas-conflict-un-says/,2916,1,1,1
IrishTimes,2025-11-27,2025-11-01,Pope Leo says global conflicts are putting humanity’s future at risk,https://www.irishtimes.com/world/middle-east/2025/11/27/pope-leo-begins-first-overseas-trip-with-visit-to-turkey/,3421,1,1,1
IrishTimes,2025-11-27,2025-11-01,"Clear, focused approach needed to deliver progress during EU presidency",https://www.irishtimes.com/special-reports/2025/11/27/clear-focused-approach-needed-to-deliver-progress-during-eu-presidency/,5907,1,1,1
IrishTimes,2025-11-27,2025-11-01,Pharma stays resilient in the face of strong global headwinds,https://www.irishtimes.com/special-reports/2025/11/27/pharma-stays-resilient-in-the-face-of-strong-global-headwinds/,6364,1,1,1
IrishTimes,2025-11-27,2025-11-01,A strategic partnership that shapes Ireland’s competitiveness and innovation landscape,https://www.irishtimes.com/special-reports/2025/11/27/a-strategic-partnership-that-shapes-irelands-competitiveness-and-innovation-landscape/,6508,1,1,1
IrishTimes,2025-11-27,2025-11-01,"Letters to the Editor, November 27th: On the MetroLink legal challenge, children and education and renaming Dublin Airport",https://www.irishtimes.com/opinion/letters/2025/11/27/letters-to-the-editor-november-27th-on-the-metrolink-legal-challenge-children-and-education-and-renaming-dublin-airport/,12852,1,1,1
IrishTimes,2025-11-28,2025-11-01,Dundalk is a long way from Tipperary but €34m is a lot for convenience,https://www.irishtimes.com/sport/racing/2025/11/28/dundalk-is-a-long-way-from-tipperary-but-34m-is-a-lot-for-convenience/,5748,1,1,1
IrishTimes,2025-11-29,2025-11-01,Government tightens screws on migration – but will changes fix issues the country faces?,https://www.irishtimes.com/politics/2025/11/29/government-tightens-screws-on-migration-but-will-changes-fix-issues-the-country-faces/,9227,1,1,1
IrishTimes,2025-12-01,2025-12-01,Tourism plan focuses on Ireland as a ‘foodie’ holiday destination,https://www.irishtimes.com/ireland/2025/12/01/tourism-plan-focuses-on-ireland-as-a-foodie-holiday-destination/,3244,1,1,1
IrishTimes,2025-12-01,2025-12-01,Irish inflation climbs over 3% again on higher energy and food prices,https://www.irishtimes.com/business/2025/12/01/irish-inflation-climbs-over-3-again-on-higher-energy-and-food-prices/,3127,1,1,1
IrishTimes,2025-12-01,2025-12-01,"A stop-start 2025, but prospects for investment are positive for the year to come",https://www.irishtimes.com/property/commercial-property/2025/12/01/a-stop-start-2025-but-prospects-for-investment-are-positive-for-the-year-to-come/,3687,1,1,1
IrishTimes,2025-12-01,2025-12-01,Food prices may moderate but won’t return to levels before Russia invaded Ukraine,https://www.irishtimes.com/business/2025/12/01/food-prices-in-ireland-may-be-about-to-moderate-but-wont-return-to-levels-before-ukraine-war/,5677,1,1,1
IrishTimes,2025-12-01,2025-12-01,Housing is now the cornerstone of Ireland’s real estate market,https://www.irishtimes.com/property/commercial-property/2025/12/01/housing-is-now-the-cornerstone-of-irelands-real-estate-market/,9323,1,1,1
IrishTimes,2025-12-02,2025-12-01,Live: Zelenskiy says he is ‘ready for a meeting with president Trump’ after Moscow talks,https://www.irishtimes.com/politics/2025/12/02/volodymyr-zelenskiy-ireland-visit-live-updates/,30498,1,1,1
IrishTimes,2025-12-02,2025-12-01,European shares flat as Bayer reverses pharma share losses,https://www.irishtimes.com/business/markets/2025/12/02/european-shares-flat-as-bayer-reverses-pharma-share-losses/,4084,1,1,1
IrishTimes,2025-12-02,2025-12-01,Data Protection Commission sought €10m budget increase to beef up staff numbers,https://www.irishtimes.com/business/2025/12/02/data-protection-commission-sought-10m-budget-increase-to-beef-up-staff-numbers/,3536,1,1,1
IrishTimes,2025-12-02,2025-12-01,Debate on further ECB rate cut all but closed,https://www.irishtimes.com/business/economy/2025/12/02/debate-on-further-ecb-rate-cut-all-but-closed/,2200,1,1,1
IrishTimes,2025-12-03,2025-12-01,Retail parks the best seller in top 10 commercial deals of 2025,https://www.irishtimes.com/property/commercial-property/2025/12/03/retail-parks-the-best-seller-in-top-10-commercial-deals-of-2025/,11401,1,1,1
IrishTimes,2025-12-03,2025-12-01,Irish commercial property market poised for renewed activity in 2026,https://www.irishtimes.com/property/commercial-property/2025/12/03/irish-commercial-property-market-poised-for-renewed-activity-in-2026/,4576,1,1,1
IrishTimes,2025-12-04,2025-12-01,Irish economy contracts by 0.3% as multinational export surge unwinds,https://www.irishtimes.com/business/2025/12/04/irish-economy-contracts-by-03-as-multinational-export-surge-unwinds/,4014,1,1,1
IrishTimes,2025-12-05,2025-12-01,What does the housing market have in store in 2026? Property experts weigh in,https://www.irishtimes.com/property/residential/2025/12/05/what-does-the-housing-market-have-in-store-in-2026-property-experts-weigh-in/,12153,1,1,1
IrishTimes,2025-12-05,2025-12-01,"Europe-US unity ‘essential’ to end Russia’s invasion of Ukraine, says France",https://www.irishtimes.com/world/asia-pacific/2025/12/05/kremlin-expects-us-response-after-talks-on-ukraine-in-moscow/,3869,1,1,1
IrishTimes,2025-12-05,2025-12-01,Could Sweden take Ireland’s crown as the Silicon Valley of Europe?,https://www.irishtimes.com/business/2025/12/05/could-sweden-be-about-to-take-irelands-crown-as-the-silicon-valley-of-europe/,14495,1,1,1
IrishTimes,2025-12-06,2025-12-01,The 50 best films of 2025: Top 10 movies of the year,https://www.irishtimes.com/culture/film/2025/12/06/the-50-best-films-of-2025-the-top-10-movies-of-the-year/,2719,1,1,1
IrishTimes,2025-12-06,2025-12-01,Cliff Taylor: Ireland dodged a bullet this year. But there’s a caveat,https://www.irishtimes.com/opinion/2025/12/06/cliff-taylor-ireland-dodged-a-bullet-this-year-but-theres-a-caveat/,6106,1,1,1
IrishTimes,2025-12-07,2025-12-01,Benin says it foiled attempted coup that saw military officers on state TV,https://www.irishtimes.com/world/africa/2025/12/07/benin-says-it-foiled-attempted-coup-that-saw-military-officers-on-state-tv/,2939,1,1,1
IrishTimes,2025-12-07,2025-12-01,The 50 best films of 2025 – a full list in reverse order,https://www.irishtimes.com/culture/film/2025/12/07/the-50-best-films-of-2025-a-full-list-in-reverse-order/,17642,1,1,1
IrishTimes,2025-12-08,2025-12-01,Delivery is the key after publication of a tourism policy that gives sector a sense of purpose,https://www.irishtimes.com/business/2025/12/08/delivery-is-the-key-after-publication-of-a-tourism-policy-that-gives-sector-a-sense-of-purpose/,5382,1,1,1
IrishTimes,2025-12-10,2025-12-01,US Federal Reserve delivers third consecutive rate cut,https://www.irishtimes.com/business/economy/2025/12/10/federal-reserve-delivers-third-consecutive-rate-cut/,3915,1,1,1
IrishTimes,2025-12-10,2025-12-01,Christine Lagarde says ECB will probably lift growth forecasts,https://www.irishtimes.com/business/2025/12/10/christine-lagarde-says-ecb-will-probably-lift-growth-forecasts/,3415,1,1,1
IrishTimes,2025-12-12,2025-12-01,Sudden reduction in exports would have ‘severe impact’ on economy,https://www.irishtimes.com/business/2025/12/12/sudden-reduction-in-exports-would-have-severe-impact-on-economy/,3492,1,1,1
IrishExaminer,2025-12-14,2025-12-01,"Jim Power: Economic future looks good, but the risks are very real",https://www.irishexaminer.com/business-columnists/arid-41759819.html,978,1,1,1
IrishTimes,2025-12-14,2025-12-01,The Irish Times view on Trump’s tariffs: a key decision for the US Supreme Court,https://www.irishtimes.com/opinion/editorials/2025/12/14/the-irish-times-view-on-trumps-tariffs-a-key-decision-for-the-us-supreme-court/,2822,1,1,1
IrishTimes,2025-12-14,2025-12-01,"Inside the Dunnes Stores apartheid strike: Bad blood, life-defining moments and doldrums",https://www.irishtimes.com/life-style/people/2025/12/14/inside-the-dunnes-stores-apartheid-strike-bad-blood-life-defining-moments-and-doldrums/,11722,1,1,1
IrishTimes,2025-12-15,2025-12-01,Chile elects far-right José Antonio Kast as next president,https://www.irishtimes.com/world/americas/2025/12/15/chile-elects-far-right-jose-antonio-kast-as-next-president/,5600,1,1,1
IrishTimes,2025-12-16,2025-12-01,Ictu advises private sector affiliates to pursue pay claims of up to 6% next year,https://www.irishtimes.com/business/economy/2025/12/16/ictu-advises-private-sector-affiliates-to-pursue-pay-claims-of-up-to-6-next-year/,2919,1,1,1
